11:52:29.116644 IP COMP3134-WINTER2025.ssh > 142.189.38.126.58249: Flags [P.], seq 1829611047:1829611155, ack 3779579363, win 513, options [nop,nop,TS val 1735611222 ecr 1800757299], length 108
11:52:29.116719 IP COMP3134-WINTER2025.ssh > 142.189.38.126.58249: Flags [P.], seq 108:144, ack 1, win 513, options [nop,nop,TS val 1735611222 ecr 1800757299], length 36
11:52:29.116775 IP COMP3134-WINTER2025.ssh > 142.189.38.126.58249: Flags [P.], seq 144:196, ack 1, win 513, options [nop,nop,TS val 1735611222 ecr 1800757299], length 52
11:52:29.116831 IP COMP3134-WINTER2025.ssh > 142.189.38.126.58249: Flags [P.], seq 196:264, ack 1, win 513, options [nop,nop,TS val 1735611222 ecr 1800757299], length 68
11:52:29.116887 IP COMP3134-WINTER2025.ssh > 142.189.38.126.58249: Flags [P.], seq 264:332, ack 1, win 513, options [nop,nop,TS val 1735611222 ecr 1800757299], length 68
11:52:29.116937 IP COMP3134-WINTER2025.ssh > 142.189.38.126.58249: Flags [P.], seq 332:368, ack 1, win 513, options [nop,nop,TS val 1735611222 ecr 1800757299], length 36
11:52:29.121703 IP 142.189.38.126.58249 > COMP3134-WINTER2025.ssh: Flags [.], ack 368, win 2048, options [nop,nop,TS val 1800757317 ecr 1735611222], length 0
11:52:29.122169 IP 142.189.38.126.58249 > COMP3134-WINTER2025.ssh: Flags [P.], seq 1:37, ack 368, win 2048, options [nop,nop,TS val 1800757317 ecr 1735611222], length 36
11:52:29.122279 IP COMP3134-WINTER2025.ssh > 142.189.38.126.58249: Flags [P.], seq 368:404, ack 37, win 513, options [nop,nop,TS val 1735611228 ecr 1800757317], length 36
11:52:29.126462 IP 142.189.38.126.58249 > COMP3134-WINTER2025.ssh: Flags [.], ack 404, win 2047, options [nop,nop,TS val 1800757322 ecr 1735611228], length 0
11:52:29.145502 IP 142.189.38.126.58249 > COMP3134-WINTER2025.ssh: Flags [P.], seq 37:73, ack 404, win 2048, options [nop,nop,TS val 1800757340 ecr 1735611228], length 36
11:52:29.145666 IP COMP3134-WINTER2025.ssh > 142.189.38.126.58249: Flags [P.], seq 404:440, ack 73, win 513, options [nop,nop,TS val 1735611251 ecr 1800757340], length 36
11:52:29.149692 IP 142.189.38.126.58249 > COMP3134-WINTER2025.ssh: Flags [.], ack 440, win 2047, options [nop,nop,TS val 1800757345 ecr 1735611251], length 0
11:52:29.168927 IP 142.189.38.126.58249 > COMP3134-WINTER2025.ssh: Flags [P.], seq 73:109, ack 440, win 2048, options [nop,nop,TS val 1800757364 ecr 1735611251], length 36
11:52:29.169084 IP COMP3134-WINTER2025.ssh > 142.189.38.126.58249: Flags [P.], seq 440:476, ack 109, win 513, options [nop,nop,TS val 1735611274 ecr 1800757364], length 36
11:52:29.173636 IP 142.189.38.126.58249 > COMP3134-WINTER2025.ssh: Flags [.], ack 476, win 2047, options [nop,nop,TS val 1800757369 ecr 1735611274], length 0
11:52:29.188626 IP 142.189.38.126.58249 > COMP3134-WINTER2025.ssh: Flags [P.], seq 109:145, ack 476, win 2048, options [nop,nop,TS val 1800757384 ecr 1735611274], length 36
11:52:29.188786 IP COMP3134-WINTER2025.ssh > 142.189.38.126.58249: Flags [P.], seq 476:512, ack 145, win 513, options [nop,nop,TS val 1735611294 ecr 1800757384], length 36
11:52:29.192623 IP 142.189.38.126.58249 > COMP3134-WINTER2025.ssh: Flags [.], ack 512, win 2047, options [nop,nop,TS val 1800757388 ecr 1735611294], length 0
11:52:29.212686 IP 142.189.38.126.58249 > COMP3134-WINTER2025.ssh: Flags [P.], seq 145:181, ack 512, win 2048, options [nop,nop,TS val 1800757408 ecr 1735611294], length 36
11:52:29.212833 IP COMP3134-WINTER2025.ssh > 142.189.38.126.58249: Flags [P.], seq 512:548, ack 181, win 513, options [nop,nop,TS val 1735611318 ecr 1800757408], length 36
11:52:29.217174 IP 142.189.38.126.58249 > COMP3134-WINTER2025.ssh: Flags [.], ack 548, win 2047, options [nop,nop,TS val 1800757413 ecr 1735611318], length 0
11:52:29.237162 IP 142.189.38.126.58249 > COMP3134-WINTER2025.ssh: Flags [P.], seq 181:217, ack 548, win 2048, options [nop,nop,TS val 1800757433 ecr 1735611318], length 36
11:52:29.237333 IP COMP3134-WINTER2025.ssh > 142.189.38.126.58249: Flags [P.], seq 548:584, ack 217, win 513, options [nop,nop,TS val 1735611343 ecr 1800757433], length 36
11:52:29.241455 IP 142.189.38.126.58249 > COMP3134-WINTER2025.ssh: Flags [.], ack 584, win 2047, options [nop,nop,TS val 1800757437 ecr 1735611343], length 0
11:52:29.261944 IP 142.189.38.126.58249 > COMP3134-WINTER2025.ssh: Flags [P.], seq 217:253, ack 584, win 2048, options [nop,nop,TS val 1800757457 ecr 1735611343], length 36
11:52:29.262115 IP COMP3134-WINTER2025.ssh > 142.189.38.126.58249: Flags [P.], seq 584:620, ack 253, win 513, options [nop,nop,TS val 1735611367 ecr 1800757457], length 36
11:52:29.266729 IP 142.189.38.126.58249 > COMP3134-WINTER2025.ssh: Flags [.], ack 620, win 2047, options [nop,nop,TS val 1800757462 ecr 1735611367], length 0
11:52:29.286498 IP 142.189.38.126.58249 > COMP3134-WINTER2025.ssh: Flags [P.], seq 253:289, ack 620, win 2048, options [nop,nop,TS val 1800757482 ecr 1735611367], length 36
11:52:29.286647 IP COMP3134-WINTER2025.ssh > 142.189.38.126.58249: Flags [P.], seq 620:656, ack 289, win 513, options [nop,nop,TS val 1735611392 ecr 1800757482], length 36
11:52:29.291449 IP 142.189.38.126.58249 > COMP3134-WINTER2025.ssh: Flags [.], ack 656, win 2047, options [nop,nop,TS val 1800757486 ecr 1735611392], length 0
11:52:29.310244 IP 142.189.38.126.58249 > COMP3134-WINTER2025.ssh: Flags [P.], seq 289:325, ack 656, win 2048, options [nop,nop,TS val 1800757505 ecr 1735611392], length 36
11:52:29.310394 IP COMP3134-WINTER2025.ssh > 142.189.38.126.58249: Flags [P.], seq 656:692, ack 325, win 513, options [nop,nop,TS val 1735611416 ecr 1800757505], length 36
11:52:29.314670 IP 142.189.38.126.58249 > COMP3134-WINTER2025.ssh: Flags [.], ack 692, win 2047, options [nop,nop,TS val 1800757510 ecr 1735611416], length 0
11:52:29.334590 IP 142.189.38.126.58249 > COMP3134-WINTER2025.ssh: Flags [P.], seq 325:361, ack 692, win 2048, options [nop,nop,TS val 1800757530 ecr 1735611416], length 36
11:52:29.334751 IP COMP3134-WINTER2025.ssh > 142.189.38.126.58249: Flags [P.], seq 692:728, ack 361, win 513, options [nop,nop,TS val 1735611440 ecr 1800757530], length 36
11:52:29.338711 IP 142.189.38.126.58249 > COMP3134-WINTER2025.ssh: Flags [.], ack 728, win 2047, options [nop,nop,TS val 1800757534 ecr 1735611440], length 0
11:52:29.358970 IP 142.189.38.126.58249 > COMP3134-WINTER2025.ssh: Flags [P.], seq 361:397, ack 728, win 2048, options [nop,nop,TS val 1800757554 ecr 1735611440], length 36
11:52:29.359123 IP COMP3134-WINTER2025.ssh > 142.189.38.126.58249: Flags [P.], seq 728:764, ack 397, win 513, options [nop,nop,TS val 1735611464 ecr 1800757554], length 36
11:52:29.363552 IP 142.189.38.126.58249 > COMP3134-WINTER2025.ssh: Flags [.], ack 764, win 2047, options [nop,nop,TS val 1800757559 ecr 1735611464], length 0
11:52:29.380093 IP 142.189.38.126.58249 > COMP3134-WINTER2025.ssh: Flags [P.], seq 397:433, ack 764, win 2048, options [nop,nop,TS val 1800757576 ecr 1735611464], length 36
11:52:29.380283 IP COMP3134-WINTER2025.ssh > 142.189.38.126.58249: Flags [P.], seq 764:800, ack 433, win 513, options [nop,nop,TS val 1735611486 ecr 1800757576], length 36
11:52:29.384223 IP 142.189.38.126.58249 > COMP3134-WINTER2025.ssh: Flags [.], ack 800, win 2047, options [nop,nop,TS val 1800757580 ecr 1735611486], length 0
11:52:29.403926 IP 142.189.38.126.58249 > COMP3134-WINTER2025.ssh: Flags [P.], seq 433:469, ack 800, win 2048, options [nop,nop,TS val 1800757600 ecr 1735611486], length 36
11:52:29.404087 IP COMP3134-WINTER2025.ssh > 142.189.38.126.58249: Flags [P.], seq 800:836, ack 469, win 513, options [nop,nop,TS val 1735611509 ecr 1800757600], length 36
11:52:29.407707 IP 142.189.38.126.58249 > COMP3134-WINTER2025.ssh: Flags [.], ack 836, win 2047, options [nop,nop,TS val 1800757603 ecr 1735611509], length 0
11:52:29.428501 IP 142.189.38.126.58249 > COMP3134-WINTER2025.ssh: Flags [P.], seq 469:505, ack 836, win 2048, options [nop,nop,TS val 1800757624 ecr 1735611509], length 36
11:52:29.428657 IP COMP3134-WINTER2025.ssh > 142.189.38.126.58249: Flags [P.], seq 836:872, ack 505, win 513, options [nop,nop,TS val 1735611534 ecr 1800757624], length 36
11:52:29.432849 IP 142.189.38.126.58249 > COMP3134-WINTER2025.ssh: Flags [.], ack 872, win 2047, options [nop,nop,TS val 1800757628 ecr 1735611534], length 0
11:52:29.449202 IP 142.189.38.126.58249 > COMP3134-WINTER2025.ssh: Flags [P.], seq 505:541, ack 872, win 2048, options [nop,nop,TS val 1800757645 ecr 1735611534], length 36
11:52:29.449352 IP COMP3134-WINTER2025.ssh > 142.189.38.126.58249: Flags [P.], seq 872:908, ack 541, win 513, options [nop,nop,TS val 1735611555 ecr 1800757645], length 36
11:52:29.452684 IP 142.189.38.126.58249 > COMP3134-WINTER2025.ssh: Flags [.], ack 908, win 2047, options [nop,nop,TS val 1800757648 ecr 1735611555], length 0
11:52:29.473347 IP 142.189.38.126.58249 > COMP3134-WINTER2025.ssh: Flags [P.], seq 541:577, ack 908, win 2048, options [nop,nop,TS val 1800757668 ecr 1735611555], length 36
11:52:29.473500 IP COMP3134-WINTER2025.ssh > 142.189.38.126.58249: Flags [P.], seq 908:944, ack 577, win 513, options [nop,nop,TS val 1735611579 ecr 1800757668], length 36
11:52:29.477725 IP 142.189.38.126.58249 > COMP3134-WINTER2025.ssh: Flags [.], ack 944, win 2047, options [nop,nop,TS val 1800757673 ecr 1735611579], length 0
11:52:29.492486 IP 142.189.38.126.58249 > COMP3134-WINTER2025.ssh: Flags [P.], seq 577:613, ack 944, win 2048, options [nop,nop,TS val 1800757688 ecr 1735611579], length 36
11:52:29.492640 IP COMP3134-WINTER2025.ssh > 142.189.38.126.58249: Flags [P.], seq 944:980, ack 613, win 513, options [nop,nop,TS val 1735611598 ecr 1800757688], length 36
11:52:29.496673 IP 142.189.38.126.58249 > COMP3134-WINTER2025.ssh: Flags [.], ack 980, win 2047, options [nop,nop,TS val 1800757692 ecr 1735611598], length 0
11:52:29.514226 IP 142.189.38.126.58249 > COMP3134-WINTER2025.ssh: Flags [P.], seq 613:649, ack 980, win 2048, options [nop,nop,TS val 1800757710 ecr 1735611598], length 36
11:52:29.514382 IP COMP3134-WINTER2025.ssh > 142.189.38.126.58249: Flags [P.], seq 980:1016, ack 649, win 513, options [nop,nop,TS val 1735611620 ecr 1800757710], length 36
11:52:29.518749 IP 142.189.38.126.58249 > COMP3134-WINTER2025.ssh: Flags [.], ack 1016, win 2047, options [nop,nop,TS val 1800757714 ecr 1735611620], length 0
11:52:29.537091 IP 142.189.38.126.58249 > COMP3134-WINTER2025.ssh: Flags [P.], seq 649:685, ack 1016, win 2048, options [nop,nop,TS val 1800757732 ecr 1735611620], length 36
11:52:29.537276 IP COMP3134-WINTER2025.ssh > 142.189.38.126.58249: Flags [P.], seq 1016:1052, ack 685, win 513, options [nop,nop,TS val 1735611642 ecr 1800757732], length 36
11:52:29.541873 IP 142.189.38.126.58249 > COMP3134-WINTER2025.ssh: Flags [.], ack 1052, win 2047, options [nop,nop,TS val 1800757737 ecr 1735611642], length 0
11:52:29.557802 IP 142.189.38.126.58249 > COMP3134-WINTER2025.ssh: Flags [P.], seq 685:721, ack 1052, win 2048, options [nop,nop,TS val 1800757753 ecr 1735611642], length 36
11:52:29.557976 IP COMP3134-WINTER2025.ssh > 142.189.38.126.58249: Flags [P.], seq 1052:1088, ack 721, win 513, options [nop,nop,TS val 1735611663 ecr 1800757753], length 36
11:52:29.561691 IP 142.189.38.126.58249 > COMP3134-WINTER2025.ssh: Flags [.], ack 1088, win 2047, options [nop,nop,TS val 1800757757 ecr 1735611663], length 0
11:52:29.578765 IP 142.189.38.126.58249 > COMP3134-WINTER2025.ssh: Flags [P.], seq 721:757, ack 1088, win 2048, options [nop,nop,TS val 1800757774 ecr 1735611663], length 36
11:52:29.578971 IP COMP3134-WINTER2025.ssh > 142.189.38.126.58249: Flags [P.], seq 1088:1124, ack 757, win 513, options [nop,nop,TS val 1735611684 ecr 1800757774], length 36
11:52:29.583120 IP 142.189.38.126.58249 > COMP3134-WINTER2025.ssh: Flags [.], ack 1124, win 2047, options [nop,nop,TS val 1800757778 ecr 1735611684], length 0
11:52:29.600336 IP 142.189.38.126.58249 > COMP3134-WINTER2025.ssh: Flags [P.], seq 757:793, ack 1124, win 2048, options [nop,nop,TS val 1800757796 ecr 1735611684], length 36
11:52:29.600487 IP COMP3134-WINTER2025.ssh > 142.189.38.126.58249: Flags [P.], seq 1124:1160, ack 793, win 513, options [nop,nop,TS val 1735611706 ecr 1800757796], length 36
11:52:29.604740 IP 142.189.38.126.58249 > COMP3134-WINTER2025.ssh: Flags [.], ack 1160, win 2047, options [nop,nop,TS val 1800757800 ecr 1735611706], length 0
11:52:29.623760 IP 142.189.38.126.58249 > COMP3134-WINTER2025.ssh: Flags [P.], seq 793:829, ack 1160, win 2048, options [nop,nop,TS val 1800757819 ecr 1735611706], length 36
11:52:29.623947 IP COMP3134-WINTER2025.ssh > 142.189.38.126.58249: Flags [P.], seq 1160:1196, ack 829, win 513, options [nop,nop,TS val 1735611729 ecr 1800757819], length 36
11:52:29.628111 IP 142.189.38.126.58249 > COMP3134-WINTER2025.ssh: Flags [.], ack 1196, win 2047, options [nop,nop,TS val 1800757823 ecr 1735611729], length 0
11:52:29.647614 IP 142.189.38.126.58249 > COMP3134-WINTER2025.ssh: Flags [P.], seq 829:865, ack 1196, win 2048, options [nop,nop,TS val 1800757843 ecr 1735611729], length 36
11:52:29.647776 IP COMP3134-WINTER2025.ssh > 142.189.38.126.58249: Flags [P.], seq 1196:1232, ack 865, win 513, options [nop,nop,TS val 1735611753 ecr 1800757843], length 36
11:52:29.651876 IP 142.189.38.126.58249 > COMP3134-WINTER2025.ssh: Flags [.], ack 1232, win 2047, options [nop,nop,TS val 1800757847 ecr 1735611753], length 0
11:52:29.670339 IP 142.189.38.126.58249 > COMP3134-WINTER2025.ssh: Flags [P.], seq 865:901, ack 1232, win 2048, options [nop,nop,TS val 1800757865 ecr 1735611753], length 36
11:52:29.670522 IP COMP3134-WINTER2025.ssh > 142.189.38.126.58249: Flags [P.], seq 1232:1268, ack 901, win 513, options [nop,nop,TS val 1735611776 ecr 1800757865], length 36
11:52:29.674357 IP 142.189.38.126.58249 > COMP3134-WINTER2025.ssh: Flags [.], ack 1268, win 2047, options [nop,nop,TS val 1800757870 ecr 1735611776], length 0
11:52:29.694249 IP 142.189.38.126.58249 > COMP3134-WINTER2025.ssh: Flags [P.], seq 901:937, ack 1268, win 2048, options [nop,nop,TS val 1800757890 ecr 1735611776], length 36
11:52:29.694442 IP COMP3134-WINTER2025.ssh > 142.189.38.126.58249: Flags [P.], seq 1268:1304, ack 937, win 513, options [nop,nop,TS val 1735611800 ecr 1800757890], length 36
11:52:29.698732 IP 142.189.38.126.58249 > COMP3134-WINTER2025.ssh: Flags [.], ack 1304, win 2047, options [nop,nop,TS val 1800757895 ecr 1735611800], length 0
11:52:29.715337 IP 142.189.38.126.58249 > COMP3134-WINTER2025.ssh: Flags [P.], seq 937:973, ack 1304, win 2048, options [nop,nop,TS val 1800757911 ecr 1735611800], length 36
11:52:29.715524 IP COMP3134-WINTER2025.ssh > 142.189.38.126.58249: Flags [P.], seq 1304:1340, ack 973, win 513, options [nop,nop,TS val 1735611821 ecr 1800757911], length 36
11:52:29.720197 IP 142.189.38.126.58249 > COMP3134-WINTER2025.ssh: Flags [.], ack 1340, win 2047, options [nop,nop,TS val 1800757916 ecr 1735611821], length 0
11:52:29.739733 IP 142.189.38.126.58249 > COMP3134-WINTER2025.ssh: Flags [P.], seq 973:1009, ack 1340, win 2048, options [nop,nop,TS val 1800757935 ecr 1735611821], length 36
11:52:29.739877 IP COMP3134-WINTER2025.ssh > 142.189.38.126.58249: Flags [P.], seq 1340:1376, ack 1009, win 513, options [nop,nop,TS val 1735611845 ecr 1800757935], length 36
11:52:29.743943 IP 142.189.38.126.58249 > COMP3134-WINTER2025.ssh: Flags [.], ack 1376, win 2047, options [nop,nop,TS val 1800757939 ecr 1735611845], length 0
11:52:29.764091 IP 142.189.38.126.58249 > COMP3134-WINTER2025.ssh: Flags [P.], seq 1009:1045, ack 1376, win 2048, options [nop,nop,TS val 1800757959 ecr 1735611845], length 36
11:52:29.764279 IP COMP3134-WINTER2025.ssh > 142.189.38.126.58249: Flags [P.], seq 1376:1412, ack 1045, win 513, options [nop,nop,TS val 1735611870 ecr 1800757959], length 36
11:52:29.767944 IP 142.189.38.126.58249 > COMP3134-WINTER2025.ssh: Flags [.], ack 1412, win 2047, options [nop,nop,TS val 1800757964 ecr 1735611870], length 0
11:52:29.786046 IP 142.189.38.126.58249 > COMP3134-WINTER2025.ssh: Flags [P.], seq 1045:1081, ack 1412, win 2048, options [nop,nop,TS val 1800757981 ecr 1735611870], length 36
11:52:29.786209 IP COMP3134-WINTER2025.ssh > 142.189.38.126.58249: Flags [P.], seq 1412:1448, ack 1081, win 513, options [nop,nop,TS val 1735611891 ecr 1800757981], length 36
11:52:29.790325 IP 142.189.38.126.58249 > COMP3134-WINTER2025.ssh: Flags [.], ack 1448, win 2047, options [nop,nop,TS val 1800757986 ecr 1735611891], length 0
11:52:29.809290 IP 142.189.38.126.58249 > COMP3134-WINTER2025.ssh: Flags [P.], seq 1081:1117, ack 1448, win 2048, options [nop,nop,TS val 1800758005 ecr 1735611891], length 36
11:52:29.809448 IP COMP3134-WINTER2025.ssh > 142.189.38.126.58249: Flags [P.], seq 1448:1484, ack 1117, win 513, options [nop,nop,TS val 1735611915 ecr 1800758005], length 36
11:52:29.812919 IP 142.189.38.126.58249 > COMP3134-WINTER2025.ssh: Flags [.], ack 1484, win 2047, options [nop,nop,TS val 1800758009 ecr 1735611915], length 0
11:52:29.834110 IP 142.189.38.126.58249 > COMP3134-WINTER2025.ssh: Flags [P.], seq 1117:1153, ack 1484, win 2048, options [nop,nop,TS val 1800758029 ecr 1735611915], length 36
11:52:29.834316 IP COMP3134-WINTER2025.ssh > 142.189.38.126.58249: Flags [P.], seq 1484:1520, ack 1153, win 513, options [nop,nop,TS val 1735611940 ecr 1800758029], length 36
11:52:29.837963 IP 142.189.38.126.58249 > COMP3134-WINTER2025.ssh: Flags [.], ack 1520, win 2047, options [nop,nop,TS val 1800758034 ecr 1735611940], length 0
11:52:29.857000 IP 142.189.38.126.58249 > COMP3134-WINTER2025.ssh: Flags [P.], seq 1153:1189, ack 1520, win 2048, options [nop,nop,TS val 1800758053 ecr 1735611940], length 36
11:52:29.857164 IP COMP3134-WINTER2025.ssh > 142.189.38.126.58249: Flags [P.], seq 1520:1556, ack 1189, win 513, options [nop,nop,TS val 1735611962 ecr 1800758053], length 36
11:52:29.861508 IP 142.189.38.126.58249 > COMP3134-WINTER2025.ssh: Flags [.], ack 1556, win 2047, options [nop,nop,TS val 1800758057 ecr 1735611962], length 0
11:52:29.878745 IP 142.189.38.126.58249 > COMP3134-WINTER2025.ssh: Flags [P.], seq 1189:1225, ack 1556, win 2048, options [nop,nop,TS val 1800758074 ecr 1735611962], length 36
11:52:29.878933 IP COMP3134-WINTER2025.ssh > 142.189.38.126.58249: Flags [P.], seq 1556:1592, ack 1225, win 513, options [nop,nop,TS val 1735611984 ecr 1800758074], length 36
11:52:29.884978 IP 142.189.38.126.58249 > COMP3134-WINTER2025.ssh: Flags [.], ack 1592, win 2047, options [nop,nop,TS val 1800758081 ecr 1735611984], length 0
11:52:29.902059 IP 142.189.38.126.58249 > COMP3134-WINTER2025.ssh: Flags [P.], seq 1225:1261, ack 1592, win 2048, options [nop,nop,TS val 1800758098 ecr 1735611984], length 36
11:52:29.902189 IP COMP3134-WINTER2025.ssh > 142.189.38.126.58249: Flags [P.], seq 1592:1628, ack 1261, win 513, options [nop,nop,TS val 1735612007 ecr 1800758098], length 36
11:52:29.906071 IP 142.189.38.126.58249 > COMP3134-WINTER2025.ssh: Flags [.], ack 1628, win 2047, options [nop,nop,TS val 1800758102 ecr 1735612007], length 0
11:52:29.924729 IP 142.189.38.126.58249 > COMP3134-WINTER2025.ssh: Flags [P.], seq 1261:1297, ack 1628, win 2048, options [nop,nop,TS val 1800758120 ecr 1735612007], length 36
11:52:29.924865 IP COMP3134-WINTER2025.ssh > 142.189.38.126.58249: Flags [P.], seq 1628:1664, ack 1297, win 513, options [nop,nop,TS val 1735612030 ecr 1800758120], length 36
11:52:29.929089 IP 142.189.38.126.58249 > COMP3134-WINTER2025.ssh: Flags [.], ack 1664, win 2047, options [nop,nop,TS val 1800758125 ecr 1735612030], length 0
11:52:29.948705 IP 142.189.38.126.58249 > COMP3134-WINTER2025.ssh: Flags [P.], seq 1297:1333, ack 1664, win 2048, options [nop,nop,TS val 1800758144 ecr 1735612030], length 36
11:52:29.948858 IP COMP3134-WINTER2025.ssh > 142.189.38.126.58249: Flags [P.], seq 1664:1700, ack 1333, win 513, options [nop,nop,TS val 1735612054 ecr 1800758144], length 36
11:52:29.952172 IP 142.189.38.126.58249 > COMP3134-WINTER2025.ssh: Flags [.], ack 1700, win 2047, options [nop,nop,TS val 1800758148 ecr 1735612054], length 0
11:52:29.971084 IP 142.189.38.126.58249 > COMP3134-WINTER2025.ssh: Flags [P.], seq 1333:1369, ack 1700, win 2048, options [nop,nop,TS val 1800758167 ecr 1735612054], length 36
11:52:29.971302 IP COMP3134-WINTER2025.ssh > 142.189.38.126.58249: Flags [P.], seq 1700:1736, ack 1369, win 513, options [nop,nop,TS val 1735612077 ecr 1800758167], length 36
11:52:29.974710 IP 142.189.38.126.58249 > COMP3134-WINTER2025.ssh: Flags [.], ack 1736, win 2047, options [nop,nop,TS val 1800758171 ecr 1735612077], length 0
11:52:29.994682 IP 142.189.38.126.58249 > COMP3134-WINTER2025.ssh: Flags [P.], seq 1369:1405, ack 1736, win 2048, options [nop,nop,TS val 1800758190 ecr 1735612077], length 36
11:52:29.994823 IP COMP3134-WINTER2025.ssh > 142.189.38.126.58249: Flags [P.], seq 1736:1772, ack 1405, win 513, options [nop,nop,TS val 1735612100 ecr 1800758190], length 36
11:52:29.998713 IP 142.189.38.126.58249 > COMP3134-WINTER2025.ssh: Flags [.], ack 1772, win 2047, options [nop,nop,TS val 1800758195 ecr 1735612100], length 0
11:52:30.017229 IP 142.189.38.126.58249 > COMP3134-WINTER2025.ssh: Flags [P.], seq 1405:1441, ack 1772, win 2048, options [nop,nop,TS val 1800758213 ecr 1735612100], length 36
11:52:30.017424 IP COMP3134-WINTER2025.ssh > 142.189.38.126.58249: Flags [P.], seq 1772:1808, ack 1441, win 513, options [nop,nop,TS val 1735612123 ecr 1800758213], length 36
11:52:30.021389 IP 142.189.38.126.58249 > COMP3134-WINTER2025.ssh: Flags [.], ack 1808, win 2047, options [nop,nop,TS val 1800758217 ecr 1735612123], length 0
11:52:30.042362 IP 142.189.38.126.58249 > COMP3134-WINTER2025.ssh: Flags [P.], seq 1441:1477, ack 1808, win 2048, options [nop,nop,TS val 1800758238 ecr 1735612123], length 36
11:52:30.042534 IP COMP3134-WINTER2025.ssh > 142.189.38.126.58249: Flags [P.], seq 1808:1844, ack 1477, win 513, options [nop,nop,TS val 1735612148 ecr 1800758238], length 36
11:52:30.046206 IP 142.189.38.126.58249 > COMP3134-WINTER2025.ssh: Flags [.], ack 1844, win 2047, options [nop,nop,TS val 1800758242 ecr 1735612148], length 0
11:52:30.066881 IP 142.189.38.126.58249 > COMP3134-WINTER2025.ssh: Flags [P.], seq 1477:1513, ack 1844, win 2048, options [nop,nop,TS val 1800758262 ecr 1735612148], length 36
11:52:30.067069 IP COMP3134-WINTER2025.ssh > 142.189.38.126.58249: Flags [P.], seq 1844:1880, ack 1513, win 513, options [nop,nop,TS val 1735612172 ecr 1800758262], length 36
11:52:30.071806 IP 142.189.38.126.58249 > COMP3134-WINTER2025.ssh: Flags [.], ack 1880, win 2047, options [nop,nop,TS val 1800758267 ecr 1735612172], length 0
11:52:30.089470 IP 142.189.38.126.58249 > COMP3134-WINTER2025.ssh: Flags [P.], seq 1513:1549, ack 1880, win 2048, options [nop,nop,TS val 1800758285 ecr 1735612172], length 36
11:52:30.089653 IP COMP3134-WINTER2025.ssh > 142.189.38.126.58249: Flags [P.], seq 1880:1916, ack 1549, win 513, options [nop,nop,TS val 1735612195 ecr 1800758285], length 36
11:52:30.094327 IP 142.189.38.126.58249 > COMP3134-WINTER2025.ssh: Flags [.], ack 1916, win 2047, options [nop,nop,TS val 1800758290 ecr 1735612195], length 0
11:52:30.112115 IP 142.189.38.126.58249 > COMP3134-WINTER2025.ssh: Flags [P.], seq 1549:1585, ack 1916, win 2048, options [nop,nop,TS val 1800758308 ecr 1735612195], length 36
11:52:30.112314 IP COMP3134-WINTER2025.ssh > 142.189.38.126.58249: Flags [P.], seq 1916:1952, ack 1585, win 513, options [nop,nop,TS val 1735612218 ecr 1800758308], length 36
11:52:30.116737 IP 142.189.38.126.58249 > COMP3134-WINTER2025.ssh: Flags [.], ack 1952, win 2047, options [nop,nop,TS val 1800758312 ecr 1735612218], length 0
11:52:30.135734 IP 142.189.38.126.58249 > COMP3134-WINTER2025.ssh: Flags [P.], seq 1585:1621, ack 1952, win 2048, options [nop,nop,TS val 1800758331 ecr 1735612218], length 36
11:52:30.135972 IP COMP3134-WINTER2025.ssh > 142.189.38.126.58249: Flags [P.], seq 1952:1988, ack 1621, win 513, options [nop,nop,TS val 1735612241 ecr 1800758331], length 36
11:52:30.140359 IP 142.189.38.126.58249 > COMP3134-WINTER2025.ssh: Flags [.], ack 1988, win 2047, options [nop,nop,TS val 1800758336 ecr 1735612241], length 0
11:52:30.158466 IP 142.189.38.126.58249 > COMP3134-WINTER2025.ssh: Flags [P.], seq 1621:1657, ack 1988, win 2048, options [nop,nop,TS val 1800758354 ecr 1735612241], length 36
11:52:30.158655 IP COMP3134-WINTER2025.ssh > 142.189.38.126.58249: Flags [P.], seq 1988:2024, ack 1657, win 513, options [nop,nop,TS val 1735612264 ecr 1800758354], length 36
11:52:30.162382 IP 142.189.38.126.58249 > COMP3134-WINTER2025.ssh: Flags [.], ack 2024, win 2047, options [nop,nop,TS val 1800758358 ecr 1735612264], length 0
11:52:30.171220 IP COMP3134-WINTER2025.34016 > 67.207.67.2.domain: Flags [S], seq 2268978207, win 64240, options [mss 1460,sackOK,TS val 2468582739 ecr 0,nop,wscale 7,tfo  cookiereq,nop,nop], length 0
11:52:30.172438 IP 67.207.67.2.domain > COMP3134-WINTER2025.34016: Flags [S.], seq 1479482517, ack 2268978208, win 65160, options [mss 1460,sackOK,TS val 212755671 ecr 2468582739,nop,wscale 9], length 0
11:52:30.172499 IP COMP3134-WINTER2025.34016 > 67.207.67.2.domain: Flags [.], ack 1, win 502, options [nop,nop,TS val 2468582741 ecr 212755671], length 0
11:52:30.172548 IP COMP3134-WINTER2025.34016 > 67.207.67.2.domain: Flags [P.], seq 1:48, ack 1, win 502, options [nop,nop,TS val 2468582741 ecr 212755671], length 47 19717+ PTR? 126.38.189.142.in-addr.arpa. (45)
11:52:30.172779 IP 67.207.67.2.domain > COMP3134-WINTER2025.34016: Flags [.], ack 48, win 128, options [nop,nop,TS val 212755672 ecr 2468582741], length 0
11:52:30.183348 IP 142.189.38.126.58249 > COMP3134-WINTER2025.ssh: Flags [P.], seq 1657:1693, ack 2024, win 2048, options [nop,nop,TS val 1800758378 ecr 1735612264], length 36
11:52:30.183531 IP COMP3134-WINTER2025.ssh > 142.189.38.126.58249: Flags [P.], seq 2024:2060, ack 1693, win 513, options [nop,nop,TS val 1735612289 ecr 1800758378], length 36
11:52:30.187608 IP 142.189.38.126.58249 > COMP3134-WINTER2025.ssh: Flags [.], ack 2060, win 2047, options [nop,nop,TS val 1800758383 ecr 1735612289], length 0
11:52:30.206249 IP 142.189.38.126.58249 > COMP3134-WINTER2025.ssh: Flags [P.], seq 1693:1729, ack 2060, win 2048, options [nop,nop,TS val 1800758402 ecr 1735612289], length 36
11:52:30.206430 IP COMP3134-WINTER2025.ssh > 142.189.38.126.58249: Flags [P.], seq 2060:2096, ack 1729, win 513, options [nop,nop,TS val 1735612312 ecr 1800758402], length 36
11:52:30.210469 IP 142.189.38.126.58249 > COMP3134-WINTER2025.ssh: Flags [.], ack 2096, win 2047, options [nop,nop,TS val 1800758406 ecr 1735612312], length 0
11:52:30.228844 IP 142.189.38.126.58249 > COMP3134-WINTER2025.ssh: Flags [P.], seq 1729:1765, ack 2096, win 2048, options [nop,nop,TS val 1800758424 ecr 1735612312], length 36
11:52:30.229029 IP COMP3134-WINTER2025.ssh > 142.189.38.126.58249: Flags [P.], seq 2096:2132, ack 1765, win 513, options [nop,nop,TS val 1735612334 ecr 1800758424], length 36
11:52:30.232965 IP 142.189.38.126.58249 > COMP3134-WINTER2025.ssh: Flags [.], ack 2132, win 2047, options [nop,nop,TS val 1800758429 ecr 1735612334], length 0
11:52:30.239508 IP 67.207.67.2.domain > COMP3134-WINTER2025.34016: Flags [P.], seq 1:48, ack 48, win 128, options [nop,nop,TS val 212755739 ecr 2468582741], length 47 19717 ServFail 0/0/0 (45)
11:52:30.239541 IP COMP3134-WINTER2025.34016 > 67.207.67.2.domain: Flags [.], ack 48, win 502, options [nop,nop,TS val 2468582808 ecr 212755739], length 0
11:52:30.239732 IP COMP3134-WINTER2025.34016 > 67.207.67.2.domain: Flags [P.], seq 48:59, ack 48, win 502, options [nop,nop,TS val 2468582808 ecr 212755739], length 11 [prefix length(0) != length(9)] (invalid)
11:52:30.239914 IP 67.207.67.2.domain > COMP3134-WINTER2025.34016: Flags [.], ack 59, win 128, options [nop,nop,TS val 212755739 ecr 2468582808], length 0
11:52:30.239930 IP 67.207.67.2.domain > COMP3134-WINTER2025.34016: Flags [F.], seq 48, ack 59, win 128, options [nop,nop,TS val 212755739 ecr 2468582808], length 0
11:52:30.239946 IP 67.207.67.2.domain > COMP3134-WINTER2025.34016: Flags [R.], seq 49, ack 59, win 128, options [nop,nop,TS val 212755739 ecr 2468582808], length 0
11:52:30.253585 IP 142.189.38.126.58249 > COMP3134-WINTER2025.ssh: Flags [P.], seq 1765:1801, ack 2132, win 2048, options [nop,nop,TS val 1800758449 ecr 1735612334], length 36
11:52:30.253743 IP COMP3134-WINTER2025.ssh > 142.189.38.126.58249: Flags [P.], seq 2132:2168, ack 1801, win 513, options [nop,nop,TS val 1735612359 ecr 1800758449], length 36
11:52:30.258494 IP 142.189.38.126.58249 > COMP3134-WINTER2025.ssh: Flags [.], ack 2168, win 2047, options [nop,nop,TS val 1800758454 ecr 1735612359], length 0
11:52:30.277694 IP 142.189.38.126.58249 > COMP3134-WINTER2025.ssh: Flags [P.], seq 1801:1837, ack 2168, win 2048, options [nop,nop,TS val 1800758473 ecr 1735612359], length 36
11:52:30.277865 IP COMP3134-WINTER2025.ssh > 142.189.38.126.58249: Flags [P.], seq 2168:2204, ack 1837, win 513, options [nop,nop,TS val 1735612383 ecr 1800758473], length 36
11:52:30.282206 IP 142.189.38.126.58249 > COMP3134-WINTER2025.ssh: Flags [.], ack 2204, win 2047, options [nop,nop,TS val 1800758478 ecr 1735612383], length 0
11:52:30.301963 IP 142.189.38.126.58249 > COMP3134-WINTER2025.ssh: Flags [P.], seq 1837:1873, ack 2204, win 2048, options [nop,nop,TS val 1800758498 ecr 1735612383], length 36
11:52:30.302136 IP COMP3134-WINTER2025.ssh > 142.189.38.126.58249: Flags [P.], seq 2204:2240, ack 1873, win 513, options [nop,nop,TS val 1735612407 ecr 1800758498], length 36
11:52:30.306069 IP 142.189.38.126.58249 > COMP3134-WINTER2025.ssh: Flags [.], ack 2240, win 2047, options [nop,nop,TS val 1800758502 ecr 1735612407], length 0
11:52:30.325734 IP 142.189.38.126.58249 > COMP3134-WINTER2025.ssh: Flags [P.], seq 1873:1909, ack 2240, win 2048, options [nop,nop,TS val 1800758521 ecr 1735612407], length 36
11:52:30.325937 IP COMP3134-WINTER2025.ssh > 142.189.38.126.58249: Flags [P.], seq 2240:2276, ack 1909, win 513, options [nop,nop,TS val 1735612431 ecr 1800758521], length 36
11:52:30.330482 IP 142.189.38.126.58249 > COMP3134-WINTER2025.ssh: Flags [.], ack 2276, win 2047, options [nop,nop,TS val 1800758526 ecr 1735612431], length 0
11:52:30.347290 IP 142.189.38.126.58249 > COMP3134-WINTER2025.ssh: Flags [P.], seq 1909:1945, ack 2276, win 2048, options [nop,nop,TS val 1800758542 ecr 1735612431], length 36
11:52:30.347440 IP COMP3134-WINTER2025.ssh > 142.189.38.126.58249: Flags [P.], seq 2276:2312, ack 1945, win 513, options [nop,nop,TS val 1735612453 ecr 1800758542], length 36
11:52:30.351480 IP 142.189.38.126.58249 > COMP3134-WINTER2025.ssh: Flags [.], ack 2312, win 2047, options [nop,nop,TS val 1800758547 ecr 1735612453], length 0
11:52:30.368940 IP 142.189.38.126.58249 > COMP3134-WINTER2025.ssh: Flags [P.], seq 1945:1981, ack 2312, win 2048, options [nop,nop,TS val 1800758565 ecr 1735612453], length 36
11:52:30.369083 IP COMP3134-WINTER2025.ssh > 142.189.38.126.58249: Flags [P.], seq 2312:2348, ack 1981, win 513, options [nop,nop,TS val 1735612474 ecr 1800758565], length 36
11:52:30.372669 IP 142.189.38.126.58249 > COMP3134-WINTER2025.ssh: Flags [.], ack 2348, win 2047, options [nop,nop,TS val 1800758568 ecr 1735612474], length 0
11:52:30.392773 IP 142.189.38.126.58249 > COMP3134-WINTER2025.ssh: Flags [P.], seq 1981:2017, ack 2348, win 2048, options [nop,nop,TS val 1800758588 ecr 1735612474], length 36
11:52:30.392925 IP COMP3134-WINTER2025.ssh > 142.189.38.126.58249: Flags [P.], seq 2348:2384, ack 2017, win 513, options [nop,nop,TS val 1735612498 ecr 1800758588], length 36
11:52:30.396626 IP 142.189.38.126.58249 > COMP3134-WINTER2025.ssh: Flags [.], ack 2384, win 2047, options [nop,nop,TS val 1800758592 ecr 1735612498], length 0
11:52:30.412277 IP 142.189.38.126.58249 > COMP3134-WINTER2025.ssh: Flags [P.], seq 2017:2053, ack 2384, win 2048, options [nop,nop,TS val 1800758608 ecr 1735612498], length 36
11:52:30.412426 IP COMP3134-WINTER2025.ssh > 142.189.38.126.58249: Flags [P.], seq 2384:2420, ack 2053, win 513, options [nop,nop,TS val 1735612518 ecr 1800758608], length 36
11:52:30.416606 IP 142.189.38.126.58249 > COMP3134-WINTER2025.ssh: Flags [.], ack 2420, win 2047, options [nop,nop,TS val 1800758612 ecr 1735612518], length 0
11:52:30.435173 IP 142.189.38.126.58249 > COMP3134-WINTER2025.ssh: Flags [P.], seq 2053:2089, ack 2420, win 2048, options [nop,nop,TS val 1800758631 ecr 1735612518], length 36
11:52:30.435347 IP COMP3134-WINTER2025.ssh > 142.189.38.126.58249: Flags [P.], seq 2420:2456, ack 2089, win 513, options [nop,nop,TS val 1735612541 ecr 1800758631], length 36
11:52:30.438821 IP 142.189.38.126.58249 > COMP3134-WINTER2025.ssh: Flags [.], ack 2456, win 2047, options [nop,nop,TS val 1800758634 ecr 1735612541], length 0
11:52:30.456183 IP 142.189.38.126.58249 > COMP3134-WINTER2025.ssh: Flags [P.], seq 2089:2125, ack 2456, win 2048, options [nop,nop,TS val 1800758652 ecr 1735612541], length 36
11:52:30.456340 IP COMP3134-WINTER2025.ssh > 142.189.38.126.58249: Flags [P.], seq 2456:2492, ack 2125, win 513, options [nop,nop,TS val 1735612562 ecr 1800758652], length 36
11:52:30.460707 IP 142.189.38.126.58249 > COMP3134-WINTER2025.ssh: Flags [.], ack 2492, win 2047, options [nop,nop,TS val 1800758656 ecr 1735612562], length 0
11:52:30.476697 IP 142.189.38.126.58249 > COMP3134-WINTER2025.ssh: Flags [P.], seq 2125:2161, ack 2492, win 2048, options [nop,nop,TS val 1800758672 ecr 1735612562], length 36
11:52:30.476855 IP COMP3134-WINTER2025.ssh > 142.189.38.126.58249: Flags [P.], seq 2492:2528, ack 2161, win 513, options [nop,nop,TS val 1735612582 ecr 1800758672], length 36
11:52:30.480826 IP 142.189.38.126.58249 > COMP3134-WINTER2025.ssh: Flags [.], ack 2528, win 2047, options [nop,nop,TS val 1800758676 ecr 1735612582], length 0
11:52:30.500677 IP 142.189.38.126.58249 > COMP3134-WINTER2025.ssh: Flags [P.], seq 2161:2197, ack 2528, win 2048, options [nop,nop,TS val 1800758696 ecr 1735612582], length 36
11:52:30.500827 IP COMP3134-WINTER2025.ssh > 142.189.38.126.58249: Flags [P.], seq 2528:2564, ack 2197, win 513, options [nop,nop,TS val 1735612606 ecr 1800758696], length 36
11:52:30.504183 IP 142.189.38.126.58249 > COMP3134-WINTER2025.ssh: Flags [.], ack 2564, win 2047, options [nop,nop,TS val 1800758700 ecr 1735612606], length 0
11:52:30.520690 IP 142.189.38.126.58249 > COMP3134-WINTER2025.ssh: Flags [P.], seq 2197:2233, ack 2564, win 2048, options [nop,nop,TS val 1800758716 ecr 1735612606], length 36
11:52:30.520829 IP COMP3134-WINTER2025.ssh > 142.189.38.126.58249: Flags [P.], seq 2564:2600, ack 2233, win 513, options [nop,nop,TS val 1735612626 ecr 1800758716], length 36
11:52:30.525065 IP 142.189.38.126.58249 > COMP3134-WINTER2025.ssh: Flags [.], ack 2600, win 2047, options [nop,nop,TS val 1800758720 ecr 1735612626], length 0
11:52:30.543637 IP 142.189.38.126.58249 > COMP3134-WINTER2025.ssh: Flags [P.], seq 2233:2269, ack 2600, win 2048, options [nop,nop,TS val 1800758739 ecr 1735612626], length 36
11:52:30.543787 IP COMP3134-WINTER2025.ssh > 142.189.38.126.58249: Flags [P.], seq 2600:2636, ack 2269, win 513, options [nop,nop,TS val 1735612649 ecr 1800758739], length 36
11:52:30.547999 IP 142.189.38.126.58249 > COMP3134-WINTER2025.ssh: Flags [.], ack 2636, win 2047, options [nop,nop,TS val 1800758743 ecr 1735612649], length 0
11:52:30.566604 IP 142.189.38.126.58249 > COMP3134-WINTER2025.ssh: Flags [P.], seq 2269:2305, ack 2636, win 2048, options [nop,nop,TS val 1800758762 ecr 1735612649], length 36
11:52:30.566765 IP COMP3134-WINTER2025.ssh > 142.189.38.126.58249: Flags [P.], seq 2636:2672, ack 2305, win 513, options [nop,nop,TS val 1735612672 ecr 1800758762], length 36
11:52:30.570708 IP 142.189.38.126.58249 > COMP3134-WINTER2025.ssh: Flags [.], ack 2672, win 2047, options [nop,nop,TS val 1800758766 ecr 1735612672], length 0
11:52:30.588479 IP 142.189.38.126.58249 > COMP3134-WINTER2025.ssh: Flags [P.], seq 2305:2341, ack 2672, win 2048, options [nop,nop,TS val 1800758785 ecr 1735612672], length 36
11:52:30.588641 IP COMP3134-WINTER2025.ssh > 142.189.38.126.58249: Flags [P.], seq 2672:2708, ack 2341, win 513, options [nop,nop,TS val 1735612694 ecr 1800758785], length 36
11:52:30.592580 IP 142.189.38.126.58249 > COMP3134-WINTER2025.ssh: Flags [.], ack 2708, win 2047, options [nop,nop,TS val 1800758788 ecr 1735612694], length 0
11:52:30.612571 IP 142.189.38.126.58249 > COMP3134-WINTER2025.ssh: Flags [P.], seq 2341:2377, ack 2708, win 2048, options [nop,nop,TS val 1800758809 ecr 1735612694], length 36
11:52:30.612706 IP COMP3134-WINTER2025.ssh > 142.189.38.126.58249: Flags [P.], seq 2708:2744, ack 2377, win 513, options [nop,nop,TS val 1735612718 ecr 1800758809], length 36
11:52:30.617223 IP 142.189.38.126.58249 > COMP3134-WINTER2025.ssh: Flags [.], ack 2744, win 2047, options [nop,nop,TS val 1800758812 ecr 1735612718], length 0
11:52:30.633857 IP 142.189.38.126.58249 > COMP3134-WINTER2025.ssh: Flags [P.], seq 2377:2413, ack 2744, win 2048, options [nop,nop,TS val 1800758829 ecr 1735612718], length 36
11:52:30.634017 IP COMP3134-WINTER2025.ssh > 142.189.38.126.58249: Flags [P.], seq 2744:2780, ack 2413, win 513, options [nop,nop,TS val 1735612739 ecr 1800758829], length 36
11:52:30.637862 IP 142.189.38.126.58249 > COMP3134-WINTER2025.ssh: Flags [.], ack 2780, win 2047, options [nop,nop,TS val 1800758833 ecr 1735612739], length 0
11:52:30.657447 IP 142.189.38.126.58249 > COMP3134-WINTER2025.ssh: Flags [P.], seq 2413:2449, ack 2780, win 2048, options [nop,nop,TS val 1800758853 ecr 1735612739], length 36
11:52:30.657814 IP COMP3134-WINTER2025.ssh > 142.189.38.126.58249: Flags [P.], seq 2780:2816, ack 2449, win 513, options [nop,nop,TS val 1735612763 ecr 1800758853], length 36
11:52:30.661927 IP 142.189.38.126.58249 > COMP3134-WINTER2025.ssh: Flags [.], ack 2816, win 2047, options [nop,nop,TS val 1800758857 ecr 1735612763], length 0
11:52:30.680159 IP 142.189.38.126.58249 > COMP3134-WINTER2025.ssh: Flags [P.], seq 2449:2485, ack 2816, win 2048, options [nop,nop,TS val 1800758876 ecr 1735612763], length 36
11:52:30.680330 IP COMP3134-WINTER2025.ssh > 142.189.38.126.58249: Flags [P.], seq 2816:2852, ack 2485, win 513, options [nop,nop,TS val 1735612786 ecr 1800758876], length 36
11:52:30.684934 IP 142.189.38.126.58249 > COMP3134-WINTER2025.ssh: Flags [.], ack 2852, win 2047, options [nop,nop,TS val 1800758880 ecr 1735612786], length 0
11:52:30.704655 IP 142.189.38.126.58249 > COMP3134-WINTER2025.ssh: Flags [P.], seq 2485:2521, ack 2852, win 2048, options [nop,nop,TS val 1800758900 ecr 1735612786], length 36
11:52:30.704808 IP COMP3134-WINTER2025.ssh > 142.189.38.126.58249: Flags [P.], seq 2852:2888, ack 2521, win 513, options [nop,nop,TS val 1735612810 ecr 1800758900], length 36
11:52:30.708972 IP 142.189.38.126.58249 > COMP3134-WINTER2025.ssh: Flags [.], ack 2888, win 2047, options [nop,nop,TS val 1800758904 ecr 1735612810], length 0
11:52:30.720389 IP 147.185.133.234.54596 > COMP3134-WINTER2025.2220: Flags [S], seq 2738922587, win 65535, options [mss 1460], length 0
11:52:30.727588 IP 142.189.38.126.58249 > COMP3134-WINTER2025.ssh: Flags [P.], seq 2521:2557, ack 2888, win 2048, options [nop,nop,TS val 1800758923 ecr 1735612810], length 36
11:52:30.727743 IP COMP3134-WINTER2025.ssh > 142.189.38.126.58249: Flags [P.], seq 2888:2924, ack 2557, win 513, options [nop,nop,TS val 1735612833 ecr 1800758923], length 36
11:52:30.731869 IP 142.189.38.126.58249 > COMP3134-WINTER2025.ssh: Flags [.], ack 2924, win 2047, options [nop,nop,TS val 1800758927 ecr 1735612833], length 0
11:52:30.750998 IP 142.189.38.126.58249 > COMP3134-WINTER2025.ssh: Flags [P.], seq 2557:2593, ack 2924, win 2048, options [nop,nop,TS val 1800758946 ecr 1735612833], length 36
11:52:30.751150 IP COMP3134-WINTER2025.ssh > 142.189.38.126.58249: Flags [P.], seq 2924:2960, ack 2593, win 513, options [nop,nop,TS val 1735612856 ecr 1800758946], length 36
11:52:30.754955 IP 142.189.38.126.58249 > COMP3134-WINTER2025.ssh: Flags [.], ack 2960, win 2047, options [nop,nop,TS val 1800758950 ecr 1735612856], length 0
